[
  {
    "id": "tm-cm-tr-001-001",
    "programSku": "CM-TR-001",
    "programSlug": "ai-fundamentals",
    "programRoute": "/training/ai-fundamentals",
    "displayName": "Jasmine R.",
    "jobTitle": "Director of Demand Gen",
    "photoUrl": null,
    "rating": 5,
    "quote": "Our marketing squad left the session with a shared language for AI and a repeatable prompting playbook we now use daily.",
    "allowPublicUse": true,
    "source": "manual",
    "createdAt": "2024-01-05"
  },
  {
    "id": "tm-cm-tr-001-002",
    "programSku": "CM-TR-001",
    "programSlug": "ai-fundamentals",
    "programRoute": "/training/ai-fundamentals",
    "displayName": "Miguel A.",
    "jobTitle": "VP, Product Operations",
    "photoUrl": null,
    "rating": 5,
    "quote": "Bill connects strategy to hands-on practice better than any other AI workshop we have brought in.",
    "allowPublicUse": true,
    "source": "manual",
    "createdAt": "2024-02-05"
  },
  {
    "id": "tm-cm-tr-001-003",
    "programSku": "CM-TR-001",
    "programSlug": "ai-fundamentals",
    "programRoute": "/training/ai-fundamentals",
    "displayName": "Priya D.",
    "jobTitle": "Agency Managing Partner",
    "photoUrl": null,
    "rating": 5,
    "quote": "I was able to immediately apply what I learned and saved hours in my first week.",
    "allowPublicUse": true,
    "source": "manual",
    "createdAt": "2024-01-25"
  },
  {
    "id": "tm-cm-tr-002-001",
    "programSku": "CM-TR-002",
    "programSlug": "ai-accelerator-workshop",
    "programRoute": "/training/ai-accelerator-workshop",
    "displayName": "Leslie K.",
    "jobTitle": "Director of Marketing",
    "photoUrl": null,
    "rating": 5,
    "quote": "We ramped new team members on AI in a single week and now ship campaigns faster than ever.",
    "allowPublicUse": true,
    "source": "manual",
    "createdAt": "2024-02-10"
  },
  {
    "id": "tm-cm-tr-002-004",
    "programSku": "CM-TR-002",
    "programSlug": "ai-accelerator-workshop",
    "programRoute": "/training/ai-accelerator-workshop",
    "displayName": "Michael C.",
    "jobTitle": "Product consultant",
    "photoUrl": null,
    "rating": 5,
    "quote": "This was amazing!",
    "allowPublicUse": true,
    "source": "training-testimonial",
    "createdAt": "2025-12-31T22:09:39.574Z"
  },
  {
    "id": "tm-cm-tr-003-001",
    "programSku": "CM-TR-003",
    "programSlug": "ai-advanced-workshop",
    "programRoute": "/training/ai-advanced-workshop",
    "displayName": "Kara M.",
    "jobTitle": "VP, Program Management",
    "photoUrl": null,
    "rating": 5,
    "quote": "Every week layered strategy with hands-on labs, so our cross-functional team left with actual workflows and the confidence to scale them.",
    "allowPublicUse": true,
    "source": "training-testimonial",
    "createdAt": "2026-01-04T18:12:00.000Z"
  },
  {
    "id": "tm-cm-tr-004-001",
    "programSku": "CM-TR-004",
    "programSlug": "ai-automation-with-agents",
    "programRoute": "/training/ai-automation-with-agents",
    "displayName": "Andre L.",
    "jobTitle": "Director of Business Operations",
    "photoUrl": null,
    "rating": 5,
    "quote": "We shipped a working n8n agent that now triages customer requests overnight. The coaching around guardrails and monitoring was priceless.",
    "allowPublicUse": true,
    "source": "training-testimonial",
    "createdAt": "2026-01-05T15:30:45.000Z"
  },
  {
    "id": "tm-cm-tr-005-001",
    "programSku": "CM-TR-005",
    "programSlug": "ai-workshop-for-content-creators",
    "programRoute": "/training/ai-workshop-for-content-creators",
    "displayName": "Daniel Kohn",
    "jobTitle": "Sales Enablement Manager / Instructional Designer",
    "photoUrl": "/images/testimonials/daniel-kohn-testimonial-photo.jpg",
    "rating": 5,
    "quote": "Before this course, prompting felt like guesswork. Learning to ask AI to refine my prompts changed everything. I used this to co-edit a book while keeping my voice intact. Now I treat AI not as a toy, but as a reliable creative partner for serious professional work.",
    "allowPublicUse": true,
    "source": "training-testimonial",
    "createdAt": "2026-01-06T20:15:56.688Z"
  },
  {
    "id": "tm-cm-tr-005-002",
    "programSku": "CM-TR-005",
    "programSlug": "ai-workshop-for-content-creators",
    "programRoute": "/training/ai-workshop-for-content-creators",
    "displayName": "Sinead Coughlan",
    "jobTitle": "Senior Technical Writer",
    "rating": 5,
    "quote": "I came in experienced but unsure how to use AI without losing rigor. This workshop taught a disciplined way to embed AI into real content systems. I now build persona-led workflows where AI speeds drafting while accuracy, structure, and judgment stay human.",
    "allowPublicUse": true,
    "source": "training-testimonial",
    "createdAt": "2026-01-07T13:58:28.634Z"
  },
  {
    "id": "tm-cm-tr-005-003",
    "programSku": "CM-TR-005",
    "programSlug": "ai-workshop-for-content-creators",
    "programRoute": "/training/ai-workshop-for-content-creators",
    "displayName": "Melanie Shears",
    "jobTitle": "Documentation Manager",
    "rating": 5,
    "quote": "Even as someone who’s been using AI tools for a couple of years, this course helped me level up fast. Bill went beyond “better prompts” and showed me advanced ways to research topics, structure real projects, and build custom GPT instructions that fit technical writing workflows. ",
    "allowPublicUse": true,
    "source": "training-testimonial",
    "createdAt": "2026-01-07T14:41:48.351Z"
  },
  {
    "id": "tm-cm-tr-005-004",
    "programSku": "CM-TR-005",
    "programSlug": "ai-workshop-for-content-creators",
    "programRoute": "/training/ai-workshop-for-content-creators",
    "displayName": "Steve G",
    "jobTitle": "Product Marketing and Growth",
    "rating": 5,
    "quote": "I thought I knew AI. This workshop showed what I was leaving on the table and how to turn it into a real playbook that improves both performance and speed: stronger assets, faster to market, and fewer dependencies across research, PM, and Eng. Bonus: it also supercharged my personal AI use.",
    "allowPublicUse": true,
    "source": "training-testimonial",
    "createdAt": "2026-02-04T20:56:42.792Z"
  },
  {
    "id": "tm-cm-tr-006-001",
    "programSku": "CM-TR-006",
    "programSlug": "ai-workshop-code-and-automate-with-ai",
    "programRoute": "/training/ai-workshop-code-and-automate-with-ai",
    "displayName": "Chris",
    "jobTitle": "Small Business Owner",
    "rating": 5,
    "quote": "It was really useful for me to learn how to use Git and GitHub. Finally!",
    "source": "training-testimonial",
    "createdAt": "2026-05-11T21:32:12.164Z",
    "allowPublicUse": true
  }
]